Title,Location,Company,Salary,Sponsored,Description
Data Scientist,"Los Angeles, CA",Meredith Corporation,None,Organic,"Job Title
Data Scientist
Job Description
Bizrate Insights:
With over 25 million surveys collected annually from thousands of retailers worldwide, Bizrate Insights is one of the largest sources of verified customer-generated seller ratings and reviews, helping both retailers and consumers make informed decisions. Bizrate Insights’ core solutions cover online visitors and buyers as well as retail store buyers, allowing retailers of all sizes to build best-in-class customer experiences, gain competitive intelligence, and attract more qualified traffic.
Why you should work with us:
Our biggest investment is in people like you. At Meredith, we offer comprehensive health benefits and 401k matching, plus career-boosting opportunities like tuition reimbursement, learning sessions and attendance at tech conferences to help you thrive.
For this role at Bizrate Insights, you can expect the fast-paced excitement of a startup with the rock-solid support from Meredith, an industry leader, with some nice perks on the side. If you are a passionate technologist who can get a lot done while having fun, come join a team of like-minded, skilled professionals where you can learn and share your knowledge!
You will:
Participating in activities across the data science lifecycle: business case definition, data collection, cleaning, integration, analysis, visualization, feature engineering, modeling with machine learning algorithms, interpreting the models/results, and reporting.
Communicating and coordinating effectively with product managers, software engineers, analytical groups and customer-facing teams in an agile environment.
Working with data processing pipelines for analyzing gigabyte- to terabyte-scale data from multiple sources.
Designing actionable data products based on statistical analysis and machine learning methods and working on their deployment to enterprise systems to move the needle for business at Meredith / Bizrate Insights.
Learning continuously in the areas of data science, machine learning, ad technology, marketing operations, data ecosystems, content operations, social media analysis and industry standard measurements.
You have:
Degree in computer science, engineering, statistics, or other quantitative fields. (Master’s degree is preferred)
Solid understanding of popular machine learning algorithms including supervised, un-supervised, and semi-supervised ones. What is the difference between algorithms? What algorithm would you choose for a given problem and why? What are the pros and cons of these algorithms? What is cross validation, hold-out sample, RMSE, overfitting, bias, …?
Proficient in one or more core data science programming languages (Python or R) and the ability to become functional in emergent languages and APIs as needed (Java, Scala, …).
Practical experience of building a full cycle machine learning engine from cleansing data to training and hyper parameter optimization to methods for evaluating the accuracy to identifying the ways to improve the accuracy of the model.
Exposed to and experienced with state-of-the-art machine learning toolkits such as Spark ML, TensorFlow, scikit-learn, xgboost, … preferably in Big Data frameworks (e.g. Apache Spark).
A self-learner with capability to switch from the independent contributor and leader of the project to a collaborative contributor on the team (and vice versa) depending on the demand of the project and availability of the resources.
Collaborate with stakeholders, partners and clients to ensure that all parties are aligned and supportive of the project's priorities, requirements, timeline and objectives.
Familiarity with the MapReduce paradigm and Apache Spark project.
Proficient with SQL as a means of gathering data from relational databases.
Practiced data manipulation and mining of structured and unstructured data.
Experience in visualizations for business stakeholders using a variety of visualization tools from MS Excel, libraries in R/Python.
Familiarity with AWS ecosystem is a plus.
It is the policy of Meredith to provide equal employment opportunity (EEO) to all persons regardless of age, color, national origin, citizenship status, physical or mental disability, race, religion, creed, gender, sex, sexual orientation, gender identity and/or expression, genetic information, marital status, status with regard to public assistance, veteran status, or any other characteristic protected by federal, state or local law. In addition, Meredith will provide reasonable accommodations for qualified individuals with disabilities.
Meredith participates in the federal E-Verify program to confirm the identity and employment authorization of all newly hired employees. For further information about the E-Verify program, please click here: http://www.uscis.gov/e-verify/employees
#NMG#"
Data Scientist,"Los Angeles, CA 90048",Ranker,None,Organic,"We're looking for a Data Scientist to lead the next chapter of data science initiatives at Ranker.

Ranker is the top destination for votable content on the internet. Our highly engaged visitors consistently generate 50 million upvotes and downvotes on practically everything in pop culture. All that voting translates into a tremendous amount of psychographic data, revealing consumer tastes in everything from movies, to TV, to music, to sports, to brands. We want to turn all this data into something that studios, networks, and brands can use to guide their decisions, and we need your help to do it.

The Data Scientist will play a leading role in determining how this data is leveraged and packaged. We need someone who not only has the expertise needed to navigate our data, but the vision to shape it into something truly game-changing for the entertainment industry, and eventually, for the broader market research universe. You’ll oversee the building of APIs, direct new analyses, develop user-facing products, and more.

You don’t have to worry about a “cold start” — Ranker already has the data infrastructure and talented engineering team you need to get to work immediately. Our data is structured and ready for analysis, allowing you to start digging into consumer tastes and building sophisticated models that studios, brands, and marketers can use to inform data-driven decisions and campaigns.

We’re already expanding beyond our growing core media business and building offshoot products in both the B2B and B2C space. Much of your work will be centered around building these products, taking Ranker’s IP and building it into new tools. Our current budding projects include a TV/movie recommendation app and a B2B business around psychographic insights.

Based in the heart of Los Angeles and established 10 years ago, the company is solidly profitable and has 80+ employees and growing.

What You’ll Do:
Drive detailed analysis to develop new insights and identify new sales, marketing, and growth opportunities
Transform complex analyses into compelling, easy-to-understand case studies and user stories
Build clear visualizations that convey complex ideas and analyses to executives and business unit leaders
Maintain and improve upon existing models and tools for internal marketing and sales teams
Translate business requirements into research components and data requirements
What You’ll Need:
Master’s degree (Ph.D. preferred) in statistics, computer science, mathematics, data science, or other quantitative science (psychology, economics, physics, etc.)
2+ years of relevant work experience in statistics, data science, or machine learning (or Ph.D. in a quantitative field)
A passion for using data to tell stories and using visualization tools to help unlock meaningful insights.
The ability to interpret and communicate complex concepts clearly to non-technical team members
Experience with quantitative analysis
A solid understanding of statistics and a demonstrated ability to understand the statistical basis of crowdsourcing
Programming and scripting skills (SQL, PHP, R, Python, etc.)
Knowledge of modern (tensorflow, keras, and pytorch) machine learning algorithms (clustering, regression, classification, optimization)
Demonstrable experience in research methodology
You Will Enjoy The Role If:
You get excited about taking ownership of problems and solving them in a fast-paced and scrappy environment, working cross-functionally with both technical and non-technical people
You want a strong data infrastructure and engineering team to back you up, rather than having to start from scratch
You are output-focused and see data science as a powerful tool to get things done, rather than as an end in itself
You are a strong critical thinker with a passion for understanding complex issues and are comfortable working on ambiguous problems
Your passion and curiosity for data is infectious"
Data Scientist,"Los Angeles, CA 90017",L.A. Care Health Plan,None,Organic,"Established in 1997, L.A. Care Health Plan is an independent public agency created by the state of California to provide health coverage to low-income Los Angeles County residents. We are the nation’s largest publicly operated health plan. Serving more than 2 million members in five health plans, we make sure our members get the right care at the right place at the right time.

Mission: L.A. Care’s mission is to provide access to quality health care for Los Angeles County's vulnerable and low-income communities and residents and to support the safety net required to achieve that purpose.
Job Summary
The Data Scientist is responsible for supporting L.A. Care’s strategic business initiatives through the application of predictive analytics as part of production workflows. This individual will lead projects through the iterative data science process (Stating the Question > Exploratory Data Analysis > Model Building > Interpretation > Communication > Operationalization), collaborating with business, I.T., and data subject matter experts from across the enterprise.
Duties
Ability to query, transform, and integrate data from multiple sources and structures. Research and develop predictive learning models using modeling software.
Effective communication of reproducible analyses and results (including failures), both visually and orally, in peer review and customer settings.
Collaborate and work closely with other departments to identify gaps and structure problems.
Propose solutions and actionable strategies to business challenges.
Work closely with domain experts (both business and data) to understand processes and solution inputs.
Monitor the performance of operationalized predictive models.
Perform other duties as assigned.
Education
Bachelor's Degree in Computer Science and/or Engineering or related field
Experience
Required:
With Bachelor's Degree: 6-8 years of traditional data analysis, including querying, aggregation, basic
statistical analysis, and visualization with the intent to provide business insights (preferably in a health plan).
2+ years of applied predictive modeling in a business setting (preferably in a health plan).
Preferred:
With Master's Degree: 4 years of traditional data analysis, including querying, aggregation, basic statistical
analysis, and visualization with the intent to provide business insights (preferably in a health plan).
Equivalent Experience:
With High School Diploma/GED: 12 years of traditional data analysis, including querying, aggregation, basic
statistical analysis, and visualization with the intent to provide business insights (preferably in a health plan).
With Associate's Degree: 9 years of traditional data analysis, including querying, aggregation, basic statistical analysis, and visualization with the intent to provide business insights (preferably in a health plan).

Skills
Required:
Working knowledge of relational databases, database structures.
Proficiency in Apache Spark, R and SQL (Tableau, Python, and SAS a plus).
Exploratory data analysis capabilities to understand the data. e.g., estimates of location and variability, correlation matrices, feature comparison visualization, trend analysis.
Regression and classification predictive model development and interpretation using: Heuristic/traditional techniques. e.g., linear regression, logistic regression, Naïve Bayes; Supervised machine learning techniques. e.g., decision trees, bootstrap aggregation, boosting, deep learning; Unsupervised machine learning techniques. e.g., k-means clustering, principal component analysis, hierarchical clustering.
Working optimally as part of a cross-functional team.
Ability to initiate and drive projects to completion with minimal guidance.
Ability to problem solve and quickly find solutions on your own.
Strong interpersonal skills, including the ability to influence management at various levels of the organizations.
Additional Information
L.A. Care offers a wide range of benefits including
Paid Time Off (PTO)
Tuition Reimbursement
Retirement Plans
Medical, Dental and Vision
Wellness Program
Volunteer Time Off (VTO)"
Data Scientist,"Los Angeles, CA",AvantStay,"$80,000 - $100,000 a year",Organic,"Who we are...
AvantStay delivers exceptional, unique stays for group travelers. The company has built a tech-enabled millennial hospitality brand to be the new standard for group experience. We are venture funded and growing rapidly in the explosive $100+ billion dollar STR industry.

What we are looking for...
A Data Scientist who can partner with the business to provide business intelligence from understanding what’s going on, identifying the right data, conducting research and doing analyses, to coming up with insights and making recommendations. You’ll be the expert in providing the valuable data insights and reporting to guide their decision making. Plus, you’ll come up with the best ways to share the data in dashboards, presentations, and written reports-to suit the need and the audience. The business insights you provide will help your product team run better and make better decisions.
What you'll do...
Gather and analyze data to solve and address highly complex business problems.
Evaluate scenarios to make predictions on future outcomes and provide prescriptive solutions that support decision making.
Explore and understand data and build advanced analytical models, then present and discuss the resulting models to any level of audience.
Design and drive the creation of new standards and best practices in the use of statistical data modeling, big data and optimization tools.
Identify and direct special studies and analyses for unique business problems and scenarios.
Proactively identify algorithms or products with high intellectual property content, assist in the evaluation of their potential for patents, where appropriate assist in the patent applications, and contribute to the intellectual property protection.
What you will bring:
M.S, or Ph.D. in math, statistics, operations research, computer science engineering, econometrics, or other quantitative field.
Must have at least 3+ years of actual working experience performing advanced quantitative analyses.
Advanced hands-on working knowledge of Python/SQL required.
Working knowledge of SAS/R is preferred.
Ability to apply advanced statistical methodologies such as mixed model (random and fixed effects), simultaneous equations, ARIMA, neural networks, and multinomial discrete choice. Ability to apply mathematical operations to such tasks as cluster analytics, sampling theory and design of experiments, analysis of variance, correlation techniques, and factor analysis.
Ability to apply advanced optimization methodologies such as linear and mixed integer optimization.
Ability to apply advanced simulation modeling methodologies and techniques.
Utilize complex computer operations (intermediate programming in 3rd and 4th generation languages, relational databases, and operating systems) and advanced features of software packages (word-processing, spreadsheet, graphics, etc.).
Must have relational database experience.
A strong passion for empirical research and for answering hard questions with data.
Legal right to work in the United States.

When you join AvantStay…
You’ll be doing work that matters alongside an experienced and dynamic team, transforming the way people travel and vacation. Your place within the colossal travel and real estate industries will leave you with a wealth of opportunities to feel both challenged to innovate and rewarded for your efforts. Of course, we will offer you pay and benefits, but we’re about more than that. AvantStay is a place where you can craft your own path to greatness. Whether you think in code, words, pictures or numbers, find your future at AvantStay.

Perks and Benefits
Salary: $80,000-$100,000
Stock option plan
Benefits and Unlimited Paid Time Off
Team bonding and off-site events
Complimentary and discount stays at AvantStay properties
Dog-friendly office
Equal Employment Opportunity...
We're proud to be an equal opportunity employer- and celebrate our employees' differences, including race, color, religion, sex, sexual orientation, gender identity, national origin, age, disability, and Veteran status. Different makes us better."
Data Scientist,"Los Angeles, CA",GOAT,None,Organic,"With over 10 million members and more than 800,000 listings, GOAT is the world’s largest marketplace for authentic sneakers. Our Data Science team supports many vital tasks around the company including authentication, personalization, fraud detection, business development, operations, and much more.
In this role you will:
Build machine learning models driving predictive APIs
Enrich the product discovery journey with recommendation streams
Solve complex logistics optimization problems
Work in cross functional teams to develop novel features and strategies
Identify and validate new features to be used across our machine learning services
Communicate the results and methodology effectively within the team and to external stakeholders
Design and run company wide experiments to provide statically validated insight
We are looking for:
Educational background in relevant field (Computer Science, Applied Mathematics, Statistics, Operations Research, Physics, Electrical & Computer Engineering, or other quantitative fields)
1+ years of professional experience
Proficiency in statistical analytics and machine learning algorithms
Proficiency in at least one mathematical programming tool such as Python or R
A quick learner, a self-starter, able to work independently, and you're willing (and able) to handle the pressures of an increasing level of responsibility
Benefits and Perks:
Medical, dental and vision coverage
Competitive salary and equity grants
Daily catered lunches from LA’s best restaurants
Unlimited vacation and sick days"
Data Scientist,"Los Angeles, CA",Snapchat,None,Organic,"We are looking for a data scientist with a deep passion for gaming to join our Snap Games team! Snap Games was launched in April 2019 with the belief that games have the power to deepen our relationships with friends and family.
As an integral member of our new games team located in our Santa Monica, CA headquarters, you will play a leading role in developing our ability to analyze data and make strategic, data-informed decisions. You will collaborate closely with product management, partnerships, game design, and engineering to create inventive, data-based approaches to solving difficult business and product problems. You will create detailed analyses on the performance of our games and products. You will help to identify industry trends and portfolio gaps. Your output will become an indispensable resource for our team, who will rely heavily on your insights to inform critical decisions in our games business.
We celebrate those who aren’t afraid to see things differently and who embrace new challenges. Together, we can create an innovative gaming platform that rewards the creativity of game developers from around the world. Snap is just getting started with gaming, and we’re excited for you to help us unfold that story.
What you’ll do:
Proactively develop new analyses and data-driven tools to create and scale insights on our players, our products, and our games
Analyze existing and future games holistically across various dimensions to assess their merits (game design, game mechanics, balance, art, game economy, total addressable audience, etc.)
Create and test hypotheses
Create visuals and dashboards to effectively report your insights
Conduct thorough playtests and reviews of proposals and prototypes for evaluation across various success metrics
Compile regular reports on specific genres or industry trends via infographics, visuals, and research synthesis
Monitor consumer trends across the PC, Console, and Mobile gaming landscapes and share findings with internal teams
Minimum Qualifications:
BS degree in math, statistics, economics, computer science, or other quantitative field
3+ years of experience working in the gaming industry
2+ years of experience analyzing large data sets, visualizing information, and informing company strategy
Fluency in SQL or other big data querying language
A deep understanding of gameplay systems and mechanics
Preferred Qualifications:
MS or Ph.D degree in math, statistics, economics, computer science, or other quantitative field
A strong passion for video games and other interactive entertainment!
A wealth of experience in playing games, with a focus on mobile and social online games.
Strong understanding of free-to-play, social gaming, and game monetization
A detail-oriented, organized person with outstanding communication skills at macro and micro levels
A fast learner who is self-motivated, curious, and open-minded
Ability to thrive in an environment with big challenges, broad impact, and quick turnaround times"
            Health Analytics Data Scientist,"Los Angeles, CA 90079",UCLA Health,None,Sponsored,"Responsibilities
The Health Analytics Data Scientist will work with a multidisciplinary team of faculty members and data scientists to extract meaningful and actionable insights from a variety of healthcare data, including but not limited to clinical, imaging, claims, and other biomedical and patient-related information. The individual will be responsible for integrating data from multiple sources with the goal of understanding the current operations of UCLA, a complex health system, including working with the Senior Data Scientists, health services researchers, and faculty to identifying areas where operational improvements can be made. The incumbent would directly contribute to delivering more efficient, more personalized care to the 600,000 unique patients seen by the UCLA Health System each year. In conjunction with the Senior Health Analytics Data Scientist, the Health Analytics Data Scientist will assist in data aggregation, data wrangling, implementation of classifiers using machine learning techniques, validation and updating of these classifiers to ensure optimal performance, exploration of clinical decision making tools, and implementation of a software platform to automate these tasks.
Qualifications
Bachelor’s or master’s degree in a quantitative field (e.g., mathematics, computer science, physics, economics, engineering, statistics, operations research, quantitative social science, etc.) highly desired, or equivalent work experience
3 or more years of advanced data analysis experience and expertise in diverse statistical, data mining techniques and technologies.
In depth knowledge of programming for data analysis, including Python, SQL, and/or R.
Experience building, querying, and modifying relational databases such as My SQL or Postgres.
Demonstrated knowledge of software development principles and architecture.
Demonstrated analytical and problem-solving abilities in the context of analyzing large, real-world datasets that may contain inconsistent, missing, and/or conflicting information.
Demonstrated skill to break down, synthesize and understand complex problems, define a solution, and implement it using advanced quantitative methods.
Skilled at oral and written communication with prior experience in giving presentations, writing technical reports, and documenting code. The ability to present technical concepts and results in a manner that is understandable to other technical and non-technical stakeholders is critical.
Self-motivated, strong work ethic, and independent.
Familiarity with cloud-based platforms such as Microsoft Azure or Amazon Web Services.
Must be a team player with excellent communication and problem-solving skills and have experience working with customers across teams.
Familiarity with scientific notebook/development environments, such as Jupyter and/or equivalents
Prior experience with development of predictive models involving clinical, biological, or health-related datasets
UCLA is an Equal Opportunity/Affirmative Action employer. All qualified applicants will receive consideration for employment without regard to race, color, religion, sex, sexual orientation, gender identity, national origin, disability, or protected Veteran status."
